[
  {
    "schema_version": "1.0",
    "id": "culturgest-2026-03-falta-de-cha-humor-tabus-e-censura",
    "source_id": "?page=50",
    "source_url": "https://www.culturgest.pt/pt/programacao/falta-de-cha-humor-tabus-censura/?page=50",
    "venue_id": "culturgest",
    "space_id": null,
    "title": "Falta de Chá: Humor, Tabus e Censura",
    "title_raw": "Falta de Chá: Humor, Tabus e Censura",
    "subtitle": "Mélanie Toulhoat, Rui Lopes, Rita Luís",
    "description": "Será que o humor pode ser tão poderoso que precise de ser eliminado? Pode o humor abalar os pilares essenciais das nossas sociedades? Fazer estalar as chávenas de chá? Que perigo traz o humor descontrolado que leva alguns poderes censórios a querer proibi-lo? E é sequer possível proibir o humor? Será que há chás que eliminam moscas?",
    "description_short": "Será que o humor pode ser tão poderoso que precise de ser eliminado? Pode o humor abalar os pilares essenciais das nossas sociedades? Fazer estalar as chávenas de chá? Que perigo traz o humor descontrolado que leva alguns poderes censórios a querer proibi-lo? E é sequer possível proibir o humor?…",
    "language_of_performance": null,
    "language_notes": null,
    "domain": "outros",
    "category": "outros",
    "subcategory": null,
    "tags": [],
    "categories_raw": [
      "Conferências e Debates"
    ],
    "dates": [
      {
        "date": "2026-03-25",
        "time_start": "19:00",
        "time_end": null,
        "duration_minutes": null,
        "is_cancelled": false,
        "is_sold_out": false,
        "notes": null
      }
    ],
    "date_first": "2026-03-25",
    "date_last": "2026-03-25",
    "total_sessions": 1,
    "is_ongoing": false,
    "date_open": "2026-03-25",
    "date_close": null,
    "event_status": "unica-sessao",
    "is_premiere": false,
    "is_national_premiere": false,
    "is_reprise": false,
    "production_origin": null,
    "is_festival": false,
    "festival_name": null,
    "festival_id": null,
    "is_multi_venue": false,
    "multi_venue_ids": [],
    "series_name": null,
    "series_edition": null,
    "audience": {
      "label": null,
      "label_raw": "",
      "age_min": null,
      "age_max": null,
      "is_family": false,
      "is_educational": false,
      "school_level": null,
      "notes": null
    },
    "price": {
      "is_free": false,
      "price_min": null,
      "price_max": null,
      "price_display": null,
      "price_raw": null,
      "ticketing_url": "https://invtdu.to/_7k8xv"
    },
    "accessibility": {
      "has_sign_language": false,
      "has_audio_description": false,
      "has_subtitles": false,
      "subtitle_language": null,
      "is_relaxed_performance": false,
      "wheelchair_accessible": true,
      "notes": null
    },
    "credits": {
      "company": null,
      "director": null,
      "conductor": null,
      "choreographer": null,
      "cast": [],
      "creative_team": [],
      "musicians": [],
      "credits_raw": null
    },
    "work": {
      "original_title": null,
      "composer": null,
      "playwright": null,
      "choreographer": null,
      "year_created": null,
      "country_of_origin": null,
      "genre_original": null
    },
    "media": {
      "cover_image": "https://www.culturgest.pt/media/filer_public_thumbnails/filer_public/8a/f8/8af81ffc-6d23-4391-8831-75528dd66ab3/01_manuel_loureiro_moscanocha_horizontal.jpg__1200x630_q85_crop_subsampling-2_upscale.jpg",
      "cover_image_local": null,
      "thumbnail": null,
      "trailer_url": null,
      "gallery": []
    },
    "dedup": {
      "fingerprint": "falta-de-cha-humor-tabus-e-censura|2026-03",
      "duplicate_of": null,
      "is_canonical": true,
      "seen_at_venues": [
        "culturgest"
      ]
    },
    "pipeline": {
      "scraped_at": "2026-03-25T16:59:11.297080+00:00",
      "scraper_id": "culturgest",
      "raw_data_hash": "sha256:f7ac5939b0177671",
      "harmonized_at": "2026-03-25T16:59:20.446010+00:00Z",
      "validated": true,
      "validation_errors": [],
      "manually_edited": false,
      "manually_edited_at": null,
      "is_active": true
    }
  },
  {
    "schema_version": "1.0",
    "id": "culturgest-2026-03-diana-niepce",
    "source_id": "?page=50",
    "source_url": "https://www.culturgest.pt/pt/programacao/diana-niepce-hornfuckers/?page=50",
    "venue_id": "culturgest",
    "space_id": null,
    "title": "Diana Niepce",
    "title_raw": "Diana Niepce",
    "subtitle": "Hornfuckers",
    "description": "Diana Niepce é autora de obras que questionam a existência de normas para o corpo humano, na sociedade e em palco. Espetáculos como\nAnda, Diana\ne\nO Outro Lado da Dança\ncolocaram a coreógrafa portuguesa na vanguarda da criação nacional.\n“Seguimos no questionamento da norma, da sua hierarquia e da sua lógica. Esquecemo-nos do que somos e do que deveríamos ser. Suspendemo-nos num universo apocalíptico, existimos e resistimos numa perversidade quotidiana, numa espécie de delírio que celebra a crueldade e a violência, enquanto tentamos sobreviver na sádica busca por uma lógica que ultrapasse a compreensão da reconfiguração e ressignificação do corpo.\nAqui, questionamos os estereótipos e desafiamos a gravidade, cruzamos o lirismo e a violência numa imagem que revela corpos em constante confronto com os seus limites. Numa paisagem composta por ordem e caos, submissão e revolta,\nHornfuckers\nquestiona o que somos, o que nos é imposto e como o sistema que nos sustenta pode ser fonte de imprevisibilidade e opressão”.",
    "description_short": "Diana Niepce é autora de obras que questionam a existência de normas para o corpo humano, na sociedade e em palco. Espetáculos como\nAnda, Diana\ne\nO Outro Lado da Dança\ncolocaram a coreógrafa portuguesa na vanguarda da criação nacional.\n“Seguimos no questionamento da norma, da sua hierarquia e da…",
    "language_of_performance": null,
    "language_notes": null,
    "domain": "artes-palco",
    "category": "danca",
    "subcategory": null,
    "tags": [],
    "categories_raw": [
      "Dança",
      "Performance"
    ],
    "dates": [
      {
        "date": "2026-03-26",
        "time_start": "21:00",
        "time_end": null,
        "duration_minutes": null,
        "is_cancelled": false,
        "is_sold_out": false,
        "notes": null
      },
      {
        "date": "2026-03-27",
        "time_start": "21:00",
        "time_end": null,
        "duration_minutes": null,
        "is_cancelled": false,
        "is_sold_out": false,
        "notes": null
      },
      {
        "date": "2026-03-28",
        "time_start": "19:00",
        "time_end": null,
        "duration_minutes": null,
        "is_cancelled": false,
        "is_sold_out": false,
        "notes": null
      }
    ],
    "date_first": "2026-03-26",
    "date_last": "2026-03-28",
    "total_sessions": 3,
    "is_ongoing": false,
    "date_open": "2026-03-26",
    "date_close": null,
    "event_status": "em-cartaz",
    "is_premiere": false,
    "is_national_premiere": true,
    "is_reprise": false,
    "production_origin": null,
    "is_festival": false,
    "festival_name": null,
    "festival_id": null,
    "is_multi_venue": false,
    "multi_venue_ids": [],
    "series_name": null,
    "series_edition": null,
    "audience": {
      "label": null,
      "label_raw": "",
      "age_min": null,
      "age_max": null,
      "is_family": false,
      "is_educational": false,
      "school_level": null,
      "notes": null
    },
    "price": {
      "is_free": false,
      "price_min": 16.0,
      "price_max": 16.0,
      "price_display": "16€",
      "price_raw": "16€ (descontos)",
      "has_discounts": true,
      "discount_notes": null,
      "ticketing_url": "https://www.ticketline.pt/evento/diana-niepce-hornfuckers-99239"
    },
    "accessibility": {
      "has_sign_language": true,
      "has_audio_description": true,
      "has_subtitles": false,
      "subtitle_language": null,
      "is_relaxed_performance": false,
      "wheelchair_accessible": true,
      "notes": null
    },
    "credits": {
      "company": null,
      "director": null,
      "conductor": null,
      "choreographer": null,
      "cast": [],
      "creative_team": [],
      "musicians": [],
      "credits_raw": null
    },
    "work": {
      "original_title": null,
      "composer": null,
      "playwright": null,
      "choreographer": null,
      "year_created": null,
      "country_of_origin": null,
      "genre_original": null
    },
    "media": {
      "cover_image": "https://www.culturgest.pt/media/filer_public_thumbnails/filer_public/5d/3e/5d3e77c7-f1a7-4f8a-84e9-8ef2c953e420/_pad0307-editaralipio_padilha.jpg__1200x630_q85_crop_subsampling-2_upscale.jpg",
      "cover_image_local": null,
      "thumbnail": null,
      "trailer_url": null,
      "gallery": []
    },
    "dedup": {
      "fingerprint": "diana-niepce|2026-03",
      "duplicate_of": null,
      "is_canonical": true,
      "seen_at_venues": [
        "culturgest"
      ]
    },
    "pipeline": {
      "scraped_at": "2026-03-25T16:59:11.664656+00:00",
      "scraper_id": "culturgest",
      "raw_data_hash": "sha256:9aba81e47c5cf204",
      "harmonized_at": "2026-03-25T16:59:20.446239+00:00Z",
      "validated": true,
      "validation_errors": [],
      "manually_edited": false,
      "manually_edited_at": null,
      "is_active": true
    }
  },
  {
    "schema_version": "1.0",
    "id": "culturgest-2026-04-do-cha-ao-iced-tea-humor-passado-e-prese",
    "source_id": "?page=50",
    "source_url": "https://www.culturgest.pt/pt/programacao/do-cha-ao-ice-tea-humor-passado-e-presente/?page=50",
    "venue_id": "culturgest",
    "space_id": null,
    "title": "Do Chá ao Iced Tea: Humor, passado e presente",
    "title_raw": "Do Chá ao Iced Tea: Humor, passado e presente",
    "subtitle": "Cristina Sampaio, Verena Alberti",